{
  "schemaVersion": "0.5",
  "storyId": "goldaxe",
  "title": "금도끼 은도끼",
  "source": "한국 전래동화 (public domain)",
  "locale": "ko-KR",
  "targetAge": [
    4,
    7
  ],
  "styleId": "hanji-watercolor-v1",
  "stage": {
    "width": 1920,
    "height": 1080,
    "safeArea": 0.05,
    "bgTreatment": {
      "blurPx": 1.0,
      "brightness": 100,
      "saturate": 100
    }
  },
  "rootNode": "n_intro",
  "canonicalEnding": "n_end_wade_honest",
  "subtitle": {
    "defaultOn": true,
    "highlightUnit": "eojeol",
    "minFontPx": 64,
    "wordSpacingEm": 0.3,
    "maxLines": 2
  },
  "assets": {
    "backgrounds": {
      "bg_forest_day": {
        "src": "bg/bg_forest_day.png",
        "tint": "#7C9A6B"
      },
      "bg_pond_day": {
        "src": "bg/bg_pond_day.png",
        "tint": "#6E8CA8"
      },
      "bg_pond_glow": {
        "src": "bg/bg_pond_glow.png",
        "tint": "#C9A24B"
      },
      "bg_home_night": {
        "src": "bg/bg_home_night.png",
        "tint": "#4A5568"
      }
    },
    "characters": {
      "woodcutter": {
        "displayName": "나무꾼",
        "tint": "#4A7FB5",
        "poses": {
          "idle": "char/char_woodcutter_idle.png",
          "sad": "char/char_woodcutter_sad.png",
          "surprise": "char/char_woodcutter_surprise.png",
          "happy": "char/char_woodcutter_happy.png"
        }
      },
      "spirit": {
        "displayName": "산신령",
        "tint": "#E8C86A",
        "poses": {
          "calm": "char/char_spirit_calm.png",
          "smile": "char/char_spirit_smile.png"
        }
      }
    },
    "props": {
      "axe_iron": {
        "src": "prop/prop_axe_iron.png",
        "tint": "#8A8F98"
      },
      "axe_gold": {
        "src": "prop/prop_axe_gold.png",
        "tint": "#E3B341"
      },
      "axe_silver": {
        "src": "prop/prop_axe_silver.png",
        "tint": "#C6CBD1"
      },
      "light_rays": {
        "src": "prop/prop_light_rays.png",
        "tint": "#FFE9A8",
        "blend": "screen"
      }
    }
  },
  "nodes": {
    "n_intro": {
      "type": "narrative",
      "beats": [
        {
          "id": "b_intro_01",
          "scene": {
            "background": "bg_forest_day",
            "camera": "pushIn",
            "transitionIn": "crossfade",
            "fx": "dust",
            "actors": [
              {
                "asset": "characters/woodcutter",
                "x": 0.32,
                "y": 0.8,
                "scale": 1.0,
                "z": 30,
                "anim": "breathe",
                "pose": "idle",
                "enter": "fadeIn"
              }
            ]
          },
          "lines": [
            {
              "id": "b_intro_01_1",
              "text": "산속 깊은 곳에 마음씨 착한 나무꾼이 살았어요.",
              "audio": "audio/b_intro_01_1.mp3",
              "durationMs": 6042,
              "wordTimings": [
                [
                  0,
                  2,
                  119,
                  692
                ],
                [
                  3,
                  5,
                  710,
                  1178
                ],
                [
                  6,
                  8,
                  1196,
                  1612
                ],
                [
                  9,
                  12,
                  1630,
                  2376
                ],
                [
                  13,
                  15,
                  2394,
                  2932
                ],
                [
                  16,
                  20,
                  2949,
                  3713
                ],
                [
                  21,
                  26,
                  3731,
                  4842
                ]
              ]
            },
            {
              "id": "b_intro_01_2",
              "text": "오늘도 지게를 지고 나무를 하러 올라갔어요.",
              "audio": "audio/b_intro_01_2.mp3",
              "durationMs": 6000,
              "wordTimings": [
                [
                  0,
                  3,
                  119,
                  814
                ],
                [
                  4,
                  7,
                  831,
                  1387
                ],
                [
                  8,
                  10,
                  1404,
                  1942
                ],
                [
                  11,
                  14,
                  1960,
                  2741
                ],
                [
                  15,
                  17,
                  2758,
                  3036
                ],
                [
                  18,
                  24,
                  3053,
                  4338
                ]
              ]
            }
          ]
        },
        {
          "id": "b_intro_02",
          "scene": {
            "background": "bg_pond_day",
            "camera": "panRight",
            "transitionIn": "pageTurn",
            "fx": "none",
            "bgTreatment": {
              "blurPx": 1.0,
              "brightness": 78,
              "saturate": 62
            },
            "actors": [
              {
                "asset": "characters/woodcutter",
                "x": 0.32,
                "y": 0.8,
                "scale": 1.0,
                "z": 30,
                "anim": "breathe",
                "pose": "sad",
                "enter": "none"
              },
              {
                "asset": "props/axe_iron",
                "x": 0.62,
                "y": 0.72,
                "scale": 0.5,
                "z": 25,
                "anim": "bob",
                "enter": "slideIn"
              }
            ]
          },
          "lines": [
            {
              "id": "b_intro_02_1",
              "text": "그런데 그만, 도끼가 손에서 미끄러졌어요.",
              "audio": "audio/b_intro_02_1.mp3",
              "durationMs": 6000,
              "wordTimings": [
                [
                  0,
                  3,
                  119,
                  744
                ],
                [
                  4,
                  7,
                  762,
                  1421
                ],
                [
                  8,
                  11,
                  1630,
                  2342
                ],
                [
                  12,
                  15,
                  2359,
                  2949
                ],
                [
                  16,
                  23,
                  2967,
                  4408
                ]
              ]
            },
            {
              "id": "b_intro_02_2",
              "text": "도끼는 깊은 연못 속으로 풍덩 빠져버렸어요.",
              "audio": "audio/b_intro_02_2.mp3",
              "durationMs": 6000,
              "wordTimings": [
                [
                  0,
                  3,
                  119,
                  849
                ],
                [
                  4,
                  6,
                  866,
                  1387
                ],
                [
                  7,
                  9,
                  1404,
                  1821
                ],
                [
                  10,
                  13,
                  1838,
                  2515
                ],
                [
                  14,
                  16,
                  2533,
                  3106
                ],
                [
                  17,
                  24,
                  3123,
                  4477
                ]
              ]
            },
            {
              "id": "b_intro_02_3",
              "text": "나무꾼은 그 자리에 주저앉고 말았어요.",
              "audio": "audio/b_intro_02_3.mp3",
              "durationMs": 6000,
              "wordTimings": [
                [
                  0,
                  4,
                  119,
                  1126
                ],
                [
                  5,
                  6,
                  1144,
                  1422
                ],
                [
                  7,
                  10,
                  1439,
                  1977
                ],
                [
                  11,
                  15,
                  1994,
                  2810
                ],
                [
                  16,
                  21,
                  2828,
                  3922
                ]
              ]
            }
          ]
        }
      ],
      "choice": {
        "promptText": "나무꾼은 어떻게 할까요?",
        "options": [
          {
            "id": "a",
            "label": "연못에 들어간다",
            "tint": "#7E94A4",
            "image": "icon/choice_wade.png",
            "next": "n_mid_wade",
            "audio": "audio/b_intro_01_opt_a.mp3",
            "wordTimings": [
              [
                0,
                3,
                119,
                831
              ],
              [
                4,
                8,
                849,
                1873
              ]
            ]
          },
          {
            "id": "b",
            "label": "앉아서 기다린다",
            "tint": "#8C9C7A",
            "image": "icon/choice_wait.png",
            "next": "n_mid_wait",
            "audio": "audio/b_intro_01_opt_b.mp3",
            "wordTimings": [
              [
                0,
                3,
                119,
                901
              ],
              [
                4,
                8,
                918,
                1994
              ]
            ]
          },
          {
            "id": "c",
            "label": "집으로 돌아간다",
            "tint": "#C4A06A",
            "image": "icon/choice_home.png",
            "next": "n_mid_home",
            "audio": "audio/b_intro_01_opt_c.mp3",
            "wordTimings": [
              [
                0,
                3,
                119,
                727